{
  "$schema": "./schemas/model-compression-config.schema.json",
  "_comment": "Конфигурационный файл для настройки компрессии 3D-моделей",
  "_description": [
    "Этот файл управляет параметрами сжатия GLB/GLTF файлов.",
    "Секция 'default' содержит настройки, применяемые ко всем моделям.",
    "Секция 'custom' позволяет переопределить настройки для конкретных моделей.",
    "Имя модели в секции 'custom' должно совпадать с именем файла без расширения .glb"
  ],
  "default": {
    "draco": {
      "method": "edgebreaker",
      "encodeSpeed": 0,
      "decodeSpeed": 5,
      "quantizePosition": 8,
      "quantizeNormal": 4,
      "quantizeTexcoord": 8,
      "quantizeColor":4,
      "quantizeGeneric": 4,
      "quantizationVolume": "mesh"
    },
    "textureCompress": {
      "format": "avif",
      "size": 256,
      "quality": 50
    },
    "instance": {
      "min": 2
    },
    "resample": {
      "tolerance": 0
    },
    "simplify": {
      "ratio": 0.9,
      "error":  0
    },
    "flatten": true,
    "dedup": true,
    "weld": true,
    "reorder": true,
    "prune": true
  },
  "custom": {

  }
}
